responce_to_question,text,text_for_sentiment,overall_sentiment
As a national savings for the healthcare system will we save money is this is running correctly?,if this is running correctly and we get buy in from the populist  would say in the long run we will see benefit you know a decade two decades down the road for sure feel that it takes a generation thats the time it takes for chronic diseases you have to actually set in and you know perhaps develop complications think for complications 10 to 15 years you should already see microvascular complications maybe about 5 to 10 years micro maybe about 10 15 then but 20 years if you can set it attitude changes as well as the whole concept of regular screening regular prevention  think you see outcomes much earlier especially when community cares involved when you have all your fitness your dietetics all this coming in together you should see much earlier results  dont think were looking at 20 years investment here  think the ministry look at a much earlier ri on the returns actuallywe should be seeing some of that but  think  has probably mentioned some of that the point essentially that for certain things if you can catch the condition a little bit earlier you can already make a difference to the outcome and many people dont proceed to do necessary screening end up with the condition fairly late where the cost of rescue is much much higher so while its correct that one should be cautious about over promising t is this is a journey that  think we really really need to take because if we dont we are staring down the gun of extremely high cost extremely high demand and manpower all of which we cant afford as a nation in the very long term so it has to be the situation where not only the health care professionals you know but the  population comes alongside and works on this grand challenge together to try to achieve that particular endpoint at the very start  spoke about this being right from the beginning of life and  didnt allude to the fact that we had to start with the ones that are greater risk so when the minister talked essentially about people signing on to this family physician they started with the older age group first but in essence we hope that by signing on mom and dad or grandpa and grandma that over time even the kids will end up seeing this particular family doctor family doctor group and we hope to start that practice earlier on in life get all the pickups done do all the preventive measures including the necessary vaccinations done early on so  think  its a journey and yes we have to climb that slope because weve spent a lot of time developing the rescue care now we really need to work essentially on prevention and promotion of health in a very serious and very concerted way,if this is running correctly and we get buy in from the populist  would say in the long run we will see benefit you know a decade two decades down the road for sure feel that it takes a generation thats the time it takes for chronic diseases you have to actually set in and you know perhaps develop complications think for complications 10 to 15 years you should already see microvascular complications maybe about 5 to 10 years micro maybe about 10 15 then but 20 years if you can set it attitude changes as well as the whole concept of regular screening regular prevention  think you see outcomes much earlier especially when community cares involved when you have all your fitness your dietetics all this coming in together you should see much earlier results  dont think were looking at 20 years investment here  think the ministry look at a much earlier ri on the returns actuallywe should be seeing some of that but  think  has probably mentioned some of that the point essentially that for certain things if you can catch the condition a little bit earlier you can already make a difference to the outcome and many people dont proceed to do necessary screening end up with the condition fairly late where the cost of rescue is much much higher so while its correct that one should be cautious about over promising t is this is a journey that  think we really really need to take because if we dont we are staring down the gun of extremely high cost extremely high demand and manpower all of which we cant afford as a nation in the very long term so it has to be the situation where not only the health care professionals you know but the  population comes alongside and works on this grand challenge together to try to achieve that particular endpoint at the very start  spoke about this being right from the beginning of life and  didnt allude to the fact that we had to start with the ones that are greater risk so when the minister talked essentially about people signing on to this family physician they started with the older age group first but in essence we hope that by signing on mom and dad or grandpa and grandma that over time even the kids will end up seeing this particular family doctor family doctor group and we hope to start that practice earlier on in life get all the pickups done do all the preventive measures including the necessary vaccinations done early on so  think  its a journey and yes we have to climb that slope because weve spent a lot of time developing the rescue care now we really need to work essentially on prevention and promotion of health in a very serious and very concerted way,MIXED
Fees will be paid to GPS based on the health risk profiles of patients and depending on the outcomes.How are you going to measure this when outcome is going to be so different for everyone?,start first what  used to hear a lot of is that when the individual case that they look after has one chronic condition lets say have attention right ts not too difficult once the person acquires diabetes and high cholesterol then the medications become more complex t becomes a lot more challenging for them to hold the case thats what they mean by the case getting more complex and the issue is how do we then make it easier for them to manage cases who have more than one chronic conditionart of the healthy sd program is that we are to prescribe a stipulated set of treatments and diagnostics on a certain profile patient as long as we can demonstrate that we have done our due diligence then we will get amply compensated in that sense so that removes a bit of the burden and the risk of the patient just being completely noncompliant despite our best efforts then the other part about it is that on very large scale kind of concept the evidence from other countries have shown that on a white population basis f you apply all these methodology of care most patients will have biometric improvements there hb one c withdraw their blood pressure readings will be better from that basis right f  manage a pool of say 5000 patients  can maybe have 100 200 ern people and overall  should see the same outcomes as demonstrated in large scale studies from other countries okay let me playa little bit of devils advocate here while it sounds workable on paper on the ground this is actually what my feelings are f we actually base remuneration based on outcome or disease outcome or improvement in health what will end up happening over a period of time f you ask me is that they may potentially be a bias towards keeping the healthier patients and shunting away the more difficult cases which then creates a negative cycle and defeats the whole purpose of healthier s g hence  am a little reserved when  say that remuneration or compensation should be based upon results or outcomes now as for whether running the appropriate laps the diagnostics are sufficient again  will challenge you that there will be different areas in  with different socio economic levels of information knowledge which may make it more difficult for certain segments of population to come regularly for their checks not because they are intentionally defaulting therapy but because their home and their community circumstances do not allow them to come at that very kind of frequency now lets say  was a g  n one of the older estates in   believe that my outcomes is measured in this kind of international yardsticks will differ very much from say corporate clinic or young g  clinic in say perhaps a little bit more young estates etcetera so  would say that we need to be really careful you know and ministry probably needs to be a bit aware that there will be some differences out there when we have to set in place a fixed target for enumerationts not just the fact about the g  s going to be the one doing all the screenings because this is where we need to form the whole cm concept of shared resources and having teams of nurses of healthcare phlebotomist who can actually make trips down patients houses to perform such checks as well our companys experience that we have done chronic disease management programs where we deploy our staff nurses of the botanists to perform both the digital  check as well as blood drawing for patients in the comfort of their own homes and that still allows patients to then follow up on the necessary checks would say that because again really depends on which views are we taking you know are we looking at it from a national perspective do we have cost savings from a national perspective if we do it you know and we organize our care in this manner,start first what  used to hear a lot of is that when the individual case that they look after has one chronic condition lets say have attention right ts not too difficult once the person acquires diabetes and high cholesterol then the medications become more complex t becomes a lot more challenging for them to hold the case thats what they mean by the case getting more complex and the issue is how do we then make it easier for them to manage cases who have more than one chronic conditionart of the healthy sd program is that we are to prescribe a stipulated set of treatments and diagnostics on a certain profile patient as long as we can demonstrate that we have done our due diligence then we will get amply compensated in that sense so that removes a bit of the burden and the risk of the patient just being completely noncompliant despite our best efforts then the other part about it is that on very large scale kind of concept the evidence from other countries have shown that on a white population basis f you apply all these methodology of care most patients will have biometric improvements there hb one c withdraw their blood pressure readings will be better from that basis right f  manage a pool of say 5000 patients  can maybe have 100 200 ern people and overall  should see the same outcomes as demonstrated in large scale studies from other countries okay let me playa little bit of devils advocate here while it sounds workable on paper on the ground this is actually what my feelings are f we actually base remuneration based on outcome or disease outcome or improvement in health what will end up happening over a period of time f you ask me is that they may potentially be a bias towards keeping the healthier patients and shunting away the more difficult cases which then creates a negative cycle and defeats the whole purpose of healthier s g hence  am a little reserved when  say that remuneration or compensation should be based upon results or outcomes now as for whether running the appropriate laps the diagnostics are sufficient again  will challenge you that there will be different areas in  with different socio economic levels of information knowledge which may make it more difficult for certain segments of population to come regularly for their checks not because they are intentionally defaulting therapy but because their home and their community circumstances do not allow them to come at that very kind of frequency now lets say  was a g  n one of the older estates in   believe that my outcomes is measured in this kind of international yardsticks will differ very much from say corporate clinic or young g  clinic in say perhaps a little bit more young estates etcetera so  would say that we need to be really careful you know and ministry probably needs to be a bit aware that there will be some differences out there when we have to set in place a fixed target for enumerationts not just the fact about the g  s going to be the one doing all the screenings because this is where we need to form the whole cm concept of shared resources and having teams of nurses of healthcare phlebotomist who can actually make trips down patients houses to perform such checks as well our companys experience that we have done chronic disease management programs where we deploy our staff nurses of the botanists to perform both the digital  check as well as blood drawing for patients in the comfort of their own homes and that still allows patients to then follow up on the necessary checks would say that because again really depends on which views are we taking you know are we looking at it from a national perspective do we have cost savings from a national perspective if we do it you know and we organize our care in this manner,NEUTRAL
From your point of view What is Healthier SG, think healthier s g s a whole rethinking of how we look at health care as a nation and to focus on the fundamentals of healthcare mainly in the fact of preventive care and to actually focus resources where they can make the biggest difference which is preventing or reducing healthcare burden when it comes to the major chronic disease groups very much focused on your cardiovascular diseases as well as maintaining a very good state of health that to me is the main focus of healthcare msg prevention and reducing any already present chronic disease burdenabsolutely  think  has got the summary there for me ll just add on one point  think its really a case of how to reshape not just what the health system thinks or what the doctors think but its really how the nation actually thinks about their illnesses because  actually have a successful healthier as japan not only must you have buy in from the physicians and the allied health stuff but you also must have it from the populist and thats really the crux of the issue because for many many years and decades  think what has happened is that weve always gone through but we think its normal you see the doctor when youre unwell see the doctor go to the hospital see the specially see the g  you know based on what you feel about it well healthier s g uts the emphasis back onto the page and its sort of like going back to school you know going back to primary school and saying hey look weve got to look at this from a completely different perspective ve got to look after myself you know ve got to look after my family my loved ones my relatives and get them to see the doctor and get a family physician in charge of their health so that they can guide them to teach them how to actually look at themselves prior to even any of these illnesses setting in so  would go even one step further to say that not only when they have already had a chronic illnesses although they do not have the end stage problems but even before they developed the chronic illnesses that will be what really healthier s g, think healthier s g s a whole rethinking of how we look at health care as a nation and to focus on the fundamentals of healthcare mainly in the fact of preventive care and to actually focus resources where they can make the biggest difference which is preventing or reducing healthcare burden when it comes to the major chronic disease groups very much focused on your cardiovascular diseases as well as maintaining a very good state of health that to me is the main focus of healthcare msg prevention and reducing any already present chronic disease burdenabsolutely  think  has got the summary there for me ll just add on one point  think its really a case of how to reshape not just what the health system thinks or what the doctors think but its really how the nation actually thinks about their illnesses because  actually have a successful healthier as japan not only must you have buy in from the physicians and the allied health stuff but you also must have it from the populist and thats really the crux of the issue because for many many years and decades  think what has happened is that weve always gone through but we think its normal you see the doctor when youre unwell see the doctor go to the hospital see the specially see the g  you know based on what you feel about it well healthier s g uts the emphasis back onto the page and its sort of like going back to school you know going back to primary school and saying hey look weve got to look at this from a completely different perspective ve got to look after myself you know ve got to look after my family my loved ones my relatives and get them to see the doctor and get a family physician in charge of their health so that they can guide them to teach them how to actually look at themselves prior to even any of these illnesses setting in so  would go even one step further to say that not only when they have already had a chronic illnesses although they do not have the end stage problems but even before they developed the chronic illnesses that will be what really healthier s g,NEUTRAL
If there's one thing that you could you know change right now fixed right now with regards to our health care system what would it be?,for me  think information to unify all the information in the health care system such that all records are transferable one of the things that ve seen during the covid situation when we launch h r  the home recovery program to have a national program on telemedicine that make a huge impact  think some of the m  h colleagues wrote a paper about it where our telemedicine system the government once saw about 203 100000 patients and we had an amazing outcome in mortality and mobility through our safety blanket shows the importance of a unified health care system a unified record system in being able to be a very good safety blanket for our entire health care system  feel that systems is the most important part of this will say vaccinations you know the accessibility to vaccinations  think weve got lots of good vaccines out there and unfortunately a huge proportion of the population who actually should get it whole shot of getting it you know so  think right now ministry also pushing some of our elderly and higher risk patients as an example for the pneumococcal vaccine and  think its short of 10 of the population who requires or should go on it are not even getting it because of ignorance and inaccessibility so if  could change it there could be equal and good access to vaccines how like how the covid vaccines will roll out that will be what  want to change immediately yousomehowwell  wish we had done all of this five or six years ago f you ask me  know weve had challenges because weve had to deal with covid and everything else and weve had other things to do to try to build the ecosystem but if we had done much of this about five or six years ago  think wed be in a happier place we might have less challenges with regard to trying to find staff but  recognize that life is a journey and this whole thing is a journey as well  wish we had done this earlier,for me  think information to unify all the information in the health care system such that all records are transferable one of the things that ve seen during the covid situation when we launch h r  the home recovery program to have a national program on telemedicine that make a huge impact  think some of the m  h colleagues wrote a paper about it where our telemedicine system the government once saw about 203 100000 patients and we had an amazing outcome in mortality and mobility through our safety blanket shows the importance of a unified health care system a unified record system in being able to be a very good safety blanket for our entire health care system  feel that systems is the most important part of this will say vaccinations you know the accessibility to vaccinations  think weve got lots of good vaccines out there and unfortunately a huge proportion of the population who actually should get it whole shot of getting it you know so  think right now ministry also pushing some of our elderly and higher risk patients as an example for the pneumococcal vaccine and  think its short of 10 of the population who requires or should go on it are not even getting it because of ignorance and inaccessibility so if  could change it there could be equal and good access to vaccines how like how the covid vaccines will roll out that will be what  want to change immediately yousomehowwell  wish we had done all of this five or six years ago f you ask me  know weve had challenges because weve had to deal with covid and everything else and weve had other things to do to try to build the ecosystem but if we had done much of this about five or six years ago  think wed be in a happier place we might have less challenges with regard to trying to find staff but  recognize that life is a journey and this whole thing is a journey as well  wish we had done this earlier,NEUTRAL
Should the typical patient be concerned about rising costs when they go see the doctor world prices increase over time?,over time we will see a general increase in cost for the whole system but if you ask me and ve actually looked at the system costs it costs a heck of a lot more for an individual to get his hypertension treated in a government hospital then it cost for them to go and see a doctor in primary care all things being equal if they could get access to the same drug and the same decisions were made and the degree of control  do know that there are certain g  groups that have done an extremely good job even earlier on when we were actually working on war on diabetes in managing diabetes with outcomes comparable if not as good as what you would get in a good hospital clinic so  have actually a lot of faith that is possible for us to move in that direction f we give them the tools and we can actually make our population see the value in doing this justtheres always a worry theres always a risk we change that there will be some adjustments to direction sometimes because a particular direction taken didnt quite work t is a journey that we have to take and its a journey that we have to take together with the population thats my field completely agree that   dont believe that there will be a waste to this because even if its short term or it runs for a few years and then the direction turns a little bit  think the key message and the key information that goes up there would be primary prevention is important health screenings are important health care must be seen as something that comes into play even before you are sick nforming the relationship as you mentioned earlier on is really really importantto echo my colleagues  think fundamentally when you talk about the whole scientific basis of medical care is always evidential that prevention is always going to be more cost effective than anything else so regardless of any policy direction change it will still have to be other point on the scientific principle  feel that this current direction we are on right will definitely come to fruition in some way or another in time to come,over time we will see a general increase in cost for the whole system but if you ask me and ve actually looked at the system costs it costs a heck of a lot more for an individual to get his hypertension treated in a government hospital then it cost for them to go and see a doctor in primary care all things being equal if they could get access to the same drug and the same decisions were made and the degree of control  do know that there are certain g  groups that have done an extremely good job even earlier on when we were actually working on war on diabetes in managing diabetes with outcomes comparable if not as good as what you would get in a good hospital clinic so  have actually a lot of faith that is possible for us to move in that direction f we give them the tools and we can actually make our population see the value in doing this justtheres always a worry theres always a risk we change that there will be some adjustments to direction sometimes because a particular direction taken didnt quite work t is a journey that we have to take and its a journey that we have to take together with the population thats my field completely agree that   dont believe that there will be a waste to this because even if its short term or it runs for a few years and then the direction turns a little bit  think the key message and the key information that goes up there would be primary prevention is important health screenings are important health care must be seen as something that comes into play even before you are sick nforming the relationship as you mentioned earlier on is really really importantto echo my colleagues  think fundamentally when you talk about the whole scientific basis of medical care is always evidential that prevention is always going to be more cost effective than anything else so regardless of any policy direction change it will still have to be other point on the scientific principle  feel that this current direction we are on right will definitely come to fruition in some way or another in time to come,MIXED
